{
  "actor_id": "act_01M1E62D76BMKXW2Q4NM6BD84F",
  "branch_id": "brn_01M1E62D76VQK80N1GBXECQKYQ",
  "command_id": "cmd-1",
  "correlation_id": "corr-1",
  "created_at": "2026-09-01T12:00:00Z",
  "effective_principal_id": "act_01M1E62D76BMKXW2Q4NM6BD84F",
  "event_type": "ScreenplayPatchAccepted",
  "id": "evt_01M1E62D77NJXBRE4RWGMX5BM6",
  "integrity_hash": "d38905b2f5b942c90d9939b5cccedaf3ed4239bdd9f97361ca667ff5299a4c13",
  "operation_id": "op-1",
  "project_id": "proj_01M1E62D76FNNBXXTGBQRJKN0D",
  "result_revision_id": "rev_01M1E62D76RATSCXCXASR9GKGC",
  "schema_version": "1.0"
}
